Handle,Title,Body (HTML),Vendor,Type,Tags,Published,Option1 Name,Option1 Value,Variant SKU,Variant Grams,Variant Inventory Tracker,Variant Inventory Qty,Variant Inventory Policy,Variant Fulfillment Service,Variant Price,Variant Compare At Price,Variant Requires Shipping,Variant Taxable,Variant Barcode,Image Src
rideaux-cat-drummer-tee,Rideaux Cat Drummer Tee,"Show off your rhythm with this iconic blue cat drummer tee. Soft, high-quality cotton.",RideauxRhythmCo.,T-Shirt,Clothing,TRUE,Size,S,RCATTEE-S,200,shopify,50,deny,manual,29.99,,TRUE,TRUE,,images/image1.jpg
rideaux-cat-drummer-tee,Rideaux Cat Drummer Tee,"Show off your rhythm with this iconic blue cat drummer tee. Soft, high-quality cotton.",RideauxRhythmCo.,T-Shirt,Clothing,TRUE,Size,M,RCATTEE-M,220,shopify,50,deny,manual,29.99,,TRUE,TRUE,,
cat-galaxy-hoodie,Galactic Drum Kit Hoodie,"Take your beats to another universe. Features the cosmic cat drummer in front of a galaxy triangle.",RideauxRhythmCo.,Hoodie,Clothing,TRUE,Size,L,RGALHOODIE-L,450,shopify,30,deny,manual,49.99,,TRUE,TRUE,,images/image3.jpg
cat-jam-poster,Cat Jam Session Poster,"A lively print showing the blue cat drummer leading a feline orchestra. Perfect for music rooms or studios.",RideauxRhythmCo.,Poster,Accessories,TRUE,Size,18x24,RCJAMPOST-18x24,80,shopify,100,deny,manual,14.99,,TRUE,TRUE,,images/image4.jpg
signature-drumsticks,Signature Drumsticks,"Custom maple drumsticks featuring the RideauxRhythmCo. cat. Great for drummers of all ages.",RideauxRhythmCo.,Drumsticks,Percussion,TRUE,Length,5A,RSIGSTICK-5A,120,shopify,40,deny,manual,12.99,,TRUE,TRUE,,images/image2.jpg
